#,Event,Date,Venue,Location,Attendance
585,UFC Fight Night: Holloway vs. Rodríguez,"Nov 13, 2021",UFC Apex,"Las Vegas, Nevada, U.S.",N/A
584,UFC 268: Usman vs. Covington 2,"Nov 6, 2021",Madison Square Garden,"New York City, New York, U.S.","20,715"
583,UFC 267: Błachowicz vs. Teixeira,"Oct 30, 2021",Etihad Arena,"Abu Dhabi, United Arab Emirates","10,171"
582,UFC Fight Night: Costa vs. Vettori,"Oct 23, 2021",UFC Apex,"Las Vegas, Nevada, U.S.",N/A
581,UFC Fight Night: Ladd vs. Dumont,"Oct 16, 2021",,,N/A
580,UFC Fight Night: Dern vs. Rodriguez,"Oct 9, 2021",,,N/A
579,UFC Fight Night: Santos vs. Walker,"Oct 2, 2021",,,N/A
578,UFC 266: Volkanovski vs. Ortega,"Sep 25, 2021",T-Mobile Arena,,"19,029"
577,UFC Fight Night: Smith vs. Spann,"Sep 18, 2021",UFC Apex,,N/A
576,UFC Fight Night: Brunson vs. Till,"Sep 4, 2021",,,N/A
575,UFC on ESPN: Barboza vs. Chikadze,"Aug 28, 2021",,,N/A
574,UFC on ESPN: Cannonier vs. Gastelum,"Aug 21, 2021",,,N/A
573,UFC 265: Lewis vs. Gane,"Aug 7, 2021",Toyota Center,"Houston, Texas, U.S.","16,604"
572,UFC on ESPN: Hall vs. Strickland,"Jul 31, 2021",UFC Apex,"Las Vegas, Nevada, U.S.",N/A
571,UFC on ESPN: Sandhagen vs. Dillashaw,"Jul 24, 2021",,,51
570,UFC on ESPN: Makhachev vs. Moisés,"Jul 17, 2021",,,0
569,UFC 264: Poirier vs. McGregor 3,"Jul 10, 2021",T-Mobile Arena,,"20,062"
568,UFC Fight Night: Gane vs. Volkov,"Jun 26, 2021",UFC Apex,,0
567,UFC on ESPN: The Korean Zombie vs. Ige,"Jun 19, 2021",,,
566,UFC 263: Adesanya vs. Vettori 2,"Jun 12, 2021",Gila River Arena,"Glendale, Arizona, U.S.","17,208"
565,UFC Fight Night: Rozenstruik vs. Sakai,"Jun 5, 2021",UFC Apex,"Las Vegas, Nevada, U.S.",0
564,UFC Fight Night: Font vs. Garbrandt,"May 22, 2021",,,
563,UFC 262: Oliveira vs. Chandler,"May 15, 2021",Toyota Center,"Houston, Texas, U.S.","16,005"
562,UFC on ESPN: Rodriguez vs. Waterson,"May 8, 2021",UFC Apex,"Las Vegas, Nevada, U.S.",0
561,UFC on ESPN: Reyes vs. Procházka,"May 1, 2021",,,
560,UFC 261: Usman vs. Masvidal 2,"Apr 24, 2021",VyStar Veterans Memorial Arena,"Jacksonville, Florida, U.S.","15,269"
559,UFC on ESPN: Whittaker vs. Gastelum,"Apr 17, 2021",UFC Apex,"Las Vegas, Nevada, U.S.",0
558,UFC on ABC: Vettori vs. Holland,"Apr 10, 2021",,,
557,UFC 260: Miocic vs. Ngannou 2,"Mar 27, 2021",,,
556,UFC on ESPN: Brunson vs. Holland,"Mar 20, 2021",,,
555,UFC Fight Night: Edwards vs. Muhammad,"Mar 13, 2021",,,
554,UFC 259: Błachowicz vs. Adesanya,"Mar 6, 2021",,,
553,UFC Fight Night: Rozenstruik vs. Gane,"Feb 27, 2021",,,
552,UFC Fight Night: Blaydes vs. Lewis,"Feb 20, 2021",,,
551,UFC 258: Usman vs. Burns,"Feb 13, 2021",,,
550,UFC Fight Night: Overeem vs. Volkov,"Feb 6, 2021",,,
549,UFC 257: Poirier vs. McGregor 2,"Jan 24, 2021",Etihad Arena,"Abu Dhabi, United Arab Emirates","2,600"
548,UFC on ESPN: Chiesa vs. Magny,"Jan 20, 2021",,,"2,000"
547,UFC on ABC: Holloway vs. Kattar,"Jan 16, 2021",,,
546,UFC Fight Night: Thompson vs. Neal,"Dec 19, 2020",UFC Apex,"Las Vegas, Nevada, U.S.",0
545,UFC 256: Figueiredo vs. Moreno,"Dec 12, 2020",,,
544,UFC on ESPN: Hermansson vs. Vettori,"Dec 5, 2020",,,
543,UFC on ESPN: Smith vs. Clark,"Nov 28, 2020",,,
542,UFC 255: Figueiredo vs. Perez,"Nov 21, 2020",,,
541,UFC Fight Night: Felder vs. dos Anjos,"Nov 14, 2020",,,
540,UFC on ESPN: Santos vs. Teixeira,"Nov 7, 2020",,,
539,UFC Fight Night: Hall vs. Silva,"Oct 31, 2020",,,
538,UFC 254: Khabib vs. Gaethje,"Oct 24, 2020",du Forum,"Abu Dhabi, United Arab Emirates",
537,UFC Fight Night: Ortega vs. The Korean Zombie,"Oct 18, 2020",,,
536,UFC Fight Night: Moraes vs. Sandhagen,"Oct 11, 2020",,,
535,UFC on ESPN: Holm vs. Aldana,"Oct 4, 2020",,,
534,UFC 253: Adesanya vs. Costa,"Sep 27, 2020",,,
533,UFC Fight Night: Covington vs. Woodley,"Sep 19, 2020",UFC Apex,"Las Vegas, Nevada, U.S.",
532,UFC Fight Night: Waterson vs. Hill,"Sep 12, 2020",,,
531,UFC Fight Night: Overeem vs. Sakai,"Sep 5, 2020",,,
530,UFC Fight Night: Smith vs. Rakić,"Aug 29, 2020",,,
529,UFC on ESPN: Munhoz vs. Edgar,"Aug 22, 2020",,,
528,UFC 252: Miocic vs. Cormier 3,"Aug 15, 2020",,,
527,UFC Fight Night: Lewis vs. Oleinik,"Aug 8, 2020",,,
526,UFC Fight Night: Brunson vs. Shahbazyan,"Aug 1, 2020",,,
525,UFC on ESPN: Whittaker vs. Till,"Jul 26, 2020",du Forum,"Abu Dhabi, United Arab Emirates",
524,UFC Fight Night: Figueiredo vs. Benavidez 2,"Jul 19, 2020",,,
523,UFC on ESPN: Kattar vs. Ige,"Jul 16, 2020",,,
522,UFC 251: Usman vs. Masvidal,"Jul 12, 2020",,,
521,UFC on ESPN: Poirier vs. Hooker,"Jun 27, 2020",UFC Apex,"Las Vegas, Nevada, U.S.",
520,UFC on ESPN: Blaydes vs. Volkov,"Jun 20, 2020",,,
519,UFC on ESPN: Eye vs. Calvillo,"Jun 13, 2020",,,
518,UFC 250: Nunes vs. Spencer,"Jun 6, 2020",,,
517,UFC on ESPN: Woodley vs. Burns,"May 30, 2020",,,
516,UFC on ESPN: Overeem vs. Harris,"May 16, 2020",VyStar Veterans Memorial Arena,"Jacksonville, Florida, U.S.",
515,UFC Fight Night: Smith vs. Teixeira,"May 13, 2020",,,
514,UFC 249: Ferguson vs. Gaethje,"May 9, 2020",,,
—,UFC Fight Night: Hermansson vs. Weidman,"May 2, 2020",Chesapeake Energy Arena,"Oklahoma City, Oklahoma, U.S.",Cancelled
—,UFC Fight Night: Smith vs. Teixeira,"Apr 25, 2020",Pinnacle Bank Arena,"Lincoln, Nebraska, U.S.",
—,UFC Fight Night: Overeem vs. Harris,"Apr 11, 2020",Moda Center,"Portland, Oregon, U.S.",
—,UFC on ESPN: Ngannou vs. Rozenstruik,"Mar 28, 2020",Nationwide Arena,"Columbus, Ohio, U.S.",
—,UFC Fight Night: Woodley vs. Edwards,"Mar 21, 2020",The O2 Arena,"London, England, U.K.",
513,UFC Fight Night: Lee vs. Oliveira,"Mar 14, 2020",Ginásio Nilson Nelson,"Brasília, Brazil",0
512,UFC 248: Adesanya vs. Romero,"Mar 7, 2020",T-Mobile Arena,"Las Vegas, Nevada, U.S.","15,077"
511,UFC Fight Night: Benavidez vs. Figueiredo,"Feb 29, 2020",Chartway Arena,"Norfolk, Virginia, U.S.","7,098"
510,UFC Fight Night: Felder vs. Hooker,"Feb 23, 2020",Spark Arena,"Auckland, New Zealand","10,025"
509,UFC Fight Night: Anderson vs. Błachowicz 2,"Feb 15, 2020",Santa Ana Star Center,"Rio Rancho, New Mexico, U.S.","6,449"
508,UFC 247: Jones vs. Reyes,"Feb 8, 2020",Toyota Center,"Houston, Texas, U.S.","17,401"
507,UFC Fight Night: Blaydes vs. dos Santos,"Jan 25, 2020",PNC Arena,"Raleigh, North Carolina, U.S.","14,533"
506,UFC 246: McGregor vs. Cowboy,"Jan 18, 2020",T-Mobile Arena,"Las Vegas, Nevada, U.S.","19,040"
505,UFC Fight Night: Edgar vs. The Korean Zombie,"Dec 21, 2019",Sajik Arena,"Busan, South Korea","10,651"
504,UFC 245: Usman vs. Covington,"Dec 14, 2019",T-Mobile Arena,"Las Vegas, Nevada, U.S.","16,811"
503,UFC on ESPN: Overeem vs. Rozenstruik,"Dec 7, 2019",Capital One Arena,"Washington, D.C., U.S.","10,816"
502,UFC Fight Night: Błachowicz vs. Jacaré,"Nov 16, 2019",Ginásio do Ibirapuera,"São Paulo, Brazil","10,344"
501,UFC Fight Night: Magomedsharipov vs. Kattar,"Nov 9, 2019",CSKA Arena,"Moscow, Russia","11,305"
500,UFC 244: Masvidal vs. Diaz,"Nov 2, 2019",Madison Square Garden,"New York City, New York, U.S.","20,143"
499,UFC Fight Night: Maia vs. Askren,"Oct 26, 2019",Singapore Indoor Stadium,"Kallang, Singapore","7,155"
498,UFC on ESPN: Reyes vs. Weidman,"Oct 18, 2019",TD Garden,"Boston, Massachusetts, U.S.","12,066"
497,UFC Fight Night: Joanna vs. Waterson,"Oct 12, 2019",Amalie Arena,"Tampa, Florida, U.S.","10,597"
496,UFC 243: Whittaker vs. Adesanya,"Oct 5, 2019",Marvel Stadium,"Melbourne, Australia","57,127"
495,UFC Fight Night: Hermansson vs. Cannonier,"Sep 28, 2019",Royal Arena,"Copenhagen, Denmark","12,767"
494,UFC Fight Night: Rodríguez vs. Stephens,"Sep 21, 2019",Arena Ciudad de México,"Mexico City, Mexico","10,112"
493,UFC Fight Night: Cowboy vs. Gaethje,"Sep 14, 2019",Rogers Arena,"Vancouver, British Columbia, Canada","15,114"
492,UFC 242: Khabib vs. Poirier,"Sep 7, 2019","The Arena, Yas Island","Abu Dhabi, United Arab Emirates",N/A
491,UFC Fight Night: Andrade vs. Zhang,"Aug 31, 2019",Shenzhen Universiade Sports Centre,"Shenzhen, China","10,302"
490,UFC 241: Cormier vs. Miocic 2,"Aug 17, 2019",Honda Center,"Anaheim, California, U.S.","17,304"
489,UFC Fight Night: Shevchenko vs. Carmouche 2,"Aug 10, 2019",Antel Arena,"Montevideo, Uruguay","9,225"
488,UFC on ESPN: Covington vs. Lawler,"Aug 3, 2019",Prudential Center,"Newark, New Jersey, U.S.","10,427"
487,UFC 240: Holloway vs. Edgar,"Jul 27, 2019",Rogers Place,"Edmonton, Alberta, Canada","12,144"
486,UFC on ESPN: dos Anjos vs. Edwards,"Jul 20, 2019",AT&T Center,"San Antonio, Texas, U.S.","9,255"
485,UFC Fight Night: de Randamie vs. Ladd,"Jul 13, 2019",Golden 1 Center,"Sacramento, California, U.S.","10,306"
484,UFC 239: Jones vs. Santos,"Jul 6, 2019",T-Mobile Arena,"Las Vegas, Nevada, U.S.","18,358"
483,UFC on ESPN: Ngannou vs. dos Santos,"Jun 29, 2019",Target Center,"Minneapolis, Minnesota, U.S.","10,123"
482,UFC Fight Night: Moicano vs. The Korean Zombie,"Jun 22, 2019",Bon Secours Wellness Arena,"Greenville, South Carolina, U.S.","7,682"
481,UFC 238: Cejudo vs. Moraes,"Jun 8, 2019",United Center,"Chicago, Illinois, U.S.","16,083"
480,UFC Fight Night: Gustafsson vs. Smith,"Jun 1, 2019",Ericsson Globe,"Stockholm, Sweden","14,319"
479,UFC Fight Night: dos Anjos vs. Lee,"May 18, 2019",Blue Cross Arena,"Rochester, New York, U.S.","8,132"
478,UFC 237: Namajunas vs. Andrade,"May 11, 2019",Jeunesse Arena,"Rio de Janeiro, Brazil","15,193"
477,UFC Fight Night: Iaquinta vs. Cowboy,"May 4, 2019",Canadian Tire Centre,"Ottawa, Ontario, Canada","10,960"
476,UFC Fight Night: Jacaré vs. Hermansson,"Apr 27, 2019",BB&T Center,"Sunrise, Florida, U.S.","12,754"
475,UFC Fight Night: Overeem vs. Oleinik,"Apr 20, 2019",Yubileyny Sports Palace,"Saint Petersburg, Russia","7,236"
474,UFC 236: Holloway vs. Poirier 2,"Apr 13, 2019",State Farm Arena,"Atlanta, Georgia, U.S.","14,297"
473,UFC on ESPN: Barboza vs. Gaethje,"Mar 30, 2019",Wells Fargo Center,"Philadelphia, Pennsylvania, U.S.","11,123"
472,UFC Fight Night: Thompson vs. Pettis,"Mar 23, 2019",Bridgestone Arena,"Nashville, Tennessee, U.S.","10,863"
471,UFC Fight Night: Till vs. Masvidal,"Mar 16, 2019",The O2 Arena,"London, England, U.K.","16,602"
470,UFC Fight Night: Lewis vs. dos Santos,"Mar 9, 2019",Intrust Bank Arena,"Wichita, Kansas, U.S.","7,265"
469,UFC 235: Jones vs. Smith,"Mar 2, 2019",T-Mobile Arena,"Las Vegas, Nevada, U.S","14,790"
468,UFC Fight Night: Błachowicz vs. Santos,"Feb 23, 2019",O2 arena,"Prague, Czech Republic","16,583"
467,UFC on ESPN: Ngannou vs. Velasquez,"Feb 17, 2019",Talking Stick Resort Arena,"Phoenix, Arizona, U.S.","14,269"
466,UFC 234: Adesanya vs. Silva,"Feb 10, 2019",Rod Laver Arena,"Melbourne, Australia","15,238"
465,UFC Fight Night: Assunção vs. Moraes 2,"Feb 2, 2019",Centro de Formação Olímpica do Nordeste,"Fortaleza, Brazil","10,040"
—,UFC 233: Cejudo vs. Dillashaw,"Jan 26, 2019",Honda Center,"Anaheim, California, U.S.",Cancelled
464,UFC Fight Night: Cejudo vs. Dillashaw,"Jan 19, 2019",Barclays Center,"Brooklyn, New York, U.S.","12,152"
463,UFC 232: Jones vs. Gustafsson 2,"Dec 29, 2018",The Forum,"Inglewood, California, U.S.","15,862"
462,UFC on Fox: Lee vs. Iaquinta 2,"Dec 15, 2018",Fiserv Forum,"Milwaukee, Wisconsin, U.S.","9,010"
461,UFC 231: Holloway vs. Ortega,"Dec 8, 2018",Scotiabank Arena,"Toronto, Ontario, Canada","19,039"
460,UFC Fight Night: dos Santos vs. Tuivasa,"Dec 2, 2018",Adelaide Entertainment Centre,"Adelaide, Australia","8,652"
459,The Ultimate Fighter: Heavy Hitters Finale,"Nov 30, 2018",Pearl Theatre,"Las Vegas, Nevada, U.S.","2,020"
458,UFC Fight Night: Blaydes vs. Ngannou 2,"Nov 24, 2018",Cadillac Arena,"Beijing, China","10,302"
457,UFC Fight Night: Magny vs. Ponzinibbio,"Nov 17, 2018",Estadio Mary Terán de Weiss,"Buenos Aires, Argentina","10,245"
456,UFC Fight Night: The Korean Zombie vs. Rodríguez,"Nov 10, 2018",Pepsi Center,"Denver, Colorado, U.S.","11,426"
455,UFC 230: Cormier vs. Lewis,"Nov 3, 2018",Madison Square Garden,"New York City, New York, U.S.","17,011"
454,UFC Fight Night: Volkan vs. Smith,"Oct 27, 2018",Avenir Centre,"Moncton, New Brunswick, Canada","6,282"
453,UFC 229: Khabib vs. McGregor,"Oct 6, 2018",T-Mobile Arena,"Las Vegas, Nevada, U.S","20,034"
452,UFC Fight Night: Santos vs. Anders,"Sep 22, 2018",Ginásio do Ibirapuera,"São Paulo, Brazil","9,485"
451,UFC Fight Night: Hunt vs. Oleinik,"Sep 15, 2018",Olimpiyskiy Stadium,"Moscow, Russia","22,603"
450,UFC 228: Woodley vs. Till,"Sep 8, 2018",American Airlines Center,"Dallas, Texas, U.S.","14,073"
449,UFC Fight Night: Gaethje vs. Vick,"Aug 25, 2018",Pinnacle Bank Arena,"Lincoln, Nebraska, U.S.","6,409"
448,UFC 227: Dillashaw vs. Garbrandt 2,"Aug 4, 2018",Staples Center,"Los Angeles, California, U.S.","17,794"
447,UFC on Fox: Alvarez vs. Poirier 2,"Jul 28, 2018",Scotiabank Saddledome,"Calgary, Alberta, Canada","10,603"
446,UFC Fight Night: Shogun vs. Smith,"Jul 22, 2018",Barclaycard Arena,"Hamburg, Germany","7,798"
445,UFC Fight Night: dos Santos vs. Ivanov,"Jul 14, 2018",CenturyLink Arena,"Boise, Idaho, U.S.","5,648"
444,UFC 226: Miocic vs. Cormier,"Jul 7, 2018",T-Mobile Arena,"Las Vegas, Nevada, U.S","17,464"
443,The Ultimate Fighter: Undefeated Finale,"Jul 6, 2018",Palms Casino Resort,,"2,123"
442,UFC Fight Night: Cowboy vs. Edwards,"Jun 23, 2018",Singapore Indoor Stadium,"Kallang, Singapore","6,419"
441,UFC 225: Whittaker vs. Romero 2,"Jun 9, 2018",United Center,"Chicago, Illinois, U.S.","18,117"
440,UFC Fight Night: Rivera vs. Moraes,"Jun 1, 2018",Adirondack Bank Center,"Utica, New York, U.S.","5,063"
439,UFC Fight Night: Thompson vs. Till,"May 27, 2018",Echo Arena,"Liverpool, England, U.K.","8,520"
438,UFC Fight Night: Maia vs. Usman,"May 19, 2018",Movistar Arena,"Santiago, Chile","11,082"
437,UFC 224: Nunes vs. Pennington,"May 12, 2018",Jeunesse Arena,"Rio de Janeiro, Brazil","10,696"
436,UFC Fight Night: Barboza vs. Lee,"Apr 21, 2018",Boardwalk Hall,"Atlantic City, New Jersey, U.S.","9,541"
435,UFC on Fox: Poirier vs. Gaethje,"Apr 14, 2018",Gila River Arena,"Glendale, Arizona, U.S.","11,382"
434,UFC 223: Khabib vs. Iaquinta,"Apr 7, 2018",Barclays Center,"Brooklyn, New York, U.S.","17,026"
433,UFC Fight Night: Werdum vs. Volkov,"Mar 17, 2018",The O2 Arena,"London, England, U.K.","16,274"
432,UFC 222: Cyborg vs. Kunitskaya,"Mar 3, 2018",T-Mobile Arena,"Las Vegas, Nevada, U.S.","12,041"
431,UFC on Fox: Emmett vs. Stephens,"Feb 24, 2018",Amway Center,"Orlando, Florida, U.S.","10,124"
430,UFC Fight Night: Cowboy vs. Medeiros,"Feb 18, 2018",Frank Erwin Center,"Austin, Texas, U.S.","10,502"
429,UFC 221: Romero vs. Rockhold,"Feb 11, 2018",Perth Arena,"Perth, Australia","12,437"
428,UFC Fight Night: Machida vs. Anders,"Feb 3, 2018",Arena Guilherme Paraense,"Belém, Brazil","10,144"
427,UFC on Fox: Jacaré vs. Brunson 2,"Jan 27, 2018",Spectrum Center,"Charlotte, North Carolina, U.S.","10,249"
426,UFC 220: Miocic vs. Ngannou,"Jan 20, 2018",TD Garden,"Boston, Massachusetts, U.S.","16,015"
425,UFC Fight Night: Stephens vs. Choi,"Jan 14, 2018",Scottrade Center,"St. Louis, Missouri, U.S.","10,052"
424,UFC 219: Cyborg vs. Holm,"Dec 30, 2017",T-Mobile Arena,"Las Vegas, Nevada, U.S.","13,561"
423,UFC on Fox: Lawler vs. dos Anjos,"Dec 16, 2017",Bell MTS Place,"Winnipeg, Manitoba, Canada","8,862"
422,UFC Fight Night: Swanson vs. Ortega,"Dec 9, 2017",Save Mart Center,"Fresno, California, U.S.","7,605"
421,UFC 218: Holloway vs. Aldo 2,"Dec 2, 2017",Little Caesars Arena,"Detroit, Michigan, U.S.","17,587"
420,The Ultimate Fighter: A New World Champion Finale,"Dec 1, 2017",Park Theater,"Las Vegas, Nevada, U.S.",N/A
419,UFC Fight Night: Bisping vs. Gastelum,"Nov 25, 2017",Mercedes-Benz Arena,"Shanghai, China","15,128"
418,UFC Fight Night: Werdum vs. Tybura,"Nov 19, 2017",Qudos Bank Arena,"Sydney, Australia","10,021"
417,UFC Fight Night: Poirier vs. Pettis,"Nov 11, 2017",Ted Constant Convocation Center,"Norfolk, Virginia, U.S.","8,442"
416,UFC 217: Bisping vs. St-Pierre,"Nov 4, 2017",Madison Square Garden,"New York City, New York, U.S.","18,201"
415,UFC Fight Night: Brunson vs. Machida,"Oct 28, 2017",Ginásio do Ibirapuera,"São Paulo, Brazil","10,265"
414,UFC Fight Night: Cowboy vs. Till,"Oct 21, 2017",Ergo Arena,"Gdańsk, Poland","11,138"
413,UFC 216: Ferguson vs. Lee,"Oct 7, 2017",T-Mobile Arena,"Las Vegas, Nevada, U.S.","10,638"
412,UFC Fight Night: Saint Preux vs. Okami,"Sep 23, 2017",Saitama Super Arena,"Saitama, Japan","8,571"
411,UFC Fight Night: Rockhold vs. Branch,"Sep 16, 2017",PPG Paints Arena,"Pittsburgh, Pennsylvania, U.S.","7,005"
410,UFC 215: Nunes vs. Shevchenko 2,"Sep 9, 2017",Rogers Place,"Edmonton, Alberta, Canada","16,232"
409,UFC Fight Night: Volkov vs. Struve,"Sep 2, 2017",Rotterdam Ahoy,"Rotterdam, Netherlands","10,224"
408,UFC Fight Night: Pettis vs. Moreno,"Aug 5, 2017",Arena Ciudad de México,"Mexico City, Mexico","10,172"
407,UFC 214: Cormier vs. Jones 2,"Jul 29, 2017",Honda Center,"Anaheim, California, U.S.","16,610"
406,UFC on Fox: Weidman vs. Gastelum,"Jul 22, 2017",Nassau Veterans Memorial Coliseum,"Uniondale, New York, U.S.","11,198"
405,UFC Fight Night: Nelson vs. Ponzinibbio,"Jul 16, 2017",The SSE Hydro,"Glasgow, Scotland, U.K.","10,589"
404,UFC 213: Romero vs. Whittaker,"Jul 8, 2017",T-Mobile Arena,"Las Vegas, Nevada, U.S.","12,834"
403,The Ultimate Fighter: Redemption Finale,"Jul 7, 2017",,,"6,308"
402,UFC Fight Night: Chiesa vs. Lee,"Jun 25, 2017",Chesapeake Energy Arena,"Oklahoma City, Oklahoma, U.S.","7,605"
401,UFC Fight Night: Holm vs. Correia,"Jun 17, 2017",Singapore Indoor Stadium,"Kallang, Singapore","8,414"
400,UFC Fight Night: Lewis vs. Hunt,"Jun 11, 2017",Spark Arena,"Auckland, New Zealand","8,649"
399,UFC 212: Aldo vs. Holloway,"Jun 3, 2017",Jeunesse Arena,"Rio de Janeiro, Brazil","15,412"
398,UFC Fight Night: Gustafsson vs. Teixeira,"May 28, 2017",Ericsson Globe,"Stockholm, Sweden","12,668"
397,UFC 211: Miocic vs. dos Santos 2,"May 13, 2017",American Airlines Center,"Dallas, Texas, U.S.","17,834"
396,UFC Fight Night: Swanson vs. Lobov,"Apr 22, 2017",Bridgestone Arena,"Nashville, Tennessee, U.S.","10,144"
395,UFC on Fox: Johnson vs. Reis,"Apr 15, 2017",Sprint Center,"Kansas City, Missouri, U.S.","12,171"
394,UFC 210: Cormier vs. Johnson 2,"Apr 8, 2017",KeyBank Center,"Buffalo, New York, U.S.","17,110"
393,UFC Fight Night: Manuwa vs. Anderson,"Mar 18, 2017",The O2 Arena,"London, England, U.K.","15,761"
392,UFC Fight Night: Belfort vs. Gastelum,"Mar 11, 2017",Centro de Formação Olímpica do Nordeste,"Fortaleza, Brazil","14,069"
391,UFC 209: Woodley vs. Thompson 2,"Mar 4, 2017",T-Mobile Arena,"Las Vegas, Nevada, U.S.","13,150"
390,UFC Fight Night: Lewis vs. Browne,"Feb 19, 2017",Scotiabank Centre,"Halifax, Nova Scotia, Canada","8,123"
389,UFC 208: Holm vs. de Randamie,"Feb 11, 2017",Barclays Center,"Brooklyn, New York, U.S.","15,628"
388,UFC Fight Night: Bermudez vs. The Korean Zombie,"Feb 4, 2017",Toyota Center,"Houston, Texas, U.S.","8,119"
387,UFC on Fox: Shevchenko vs. Peña,"Jan 28, 2017",Pepsi Center,"Denver, Colorado, U.S.","13,233"
386,UFC Fight Night: Rodríguez vs. Penn,"Jan 15, 2017",Talking Stick Resort Arena,"Phoenix, Arizona, U.S.","11,589"
385,UFC 207: Nunes vs. Rousey,"Dec 30, 2016",T-Mobile Arena,"Las Vegas, Nevada, U.S.","18,533"
384,UFC on Fox: VanZant vs. Waterson,"Dec 17, 2016",Golden 1 Center,"Sacramento, California, U.S.","13,136"
383,UFC 206: Holloway vs. Pettis,"Dec 10, 2016",Scotiabank Arena,"Toronto, Ontario, Canada","18,057"
382,UFC Fight Night: Lewis vs. Abdurakhimov,"Dec 9, 2016",Times Union Center,"Albany, New York, U.S.","6,216"
381,The Ultimate Fighter: Tournament of Champions Finale,"Dec 3, 2016",Palms Casino Resort,"Las Vegas, Nevada, U.S.","2,044"
380,UFC Fight Night: Whittaker vs. Brunson,"Nov 27, 2016",Rod Laver Arena,"Melbourne, Australia","13,721"
379,UFC Fight Night: Bader vs. Nogueira 2,"Nov 19, 2016",Ginásio do Ibirapuera,"São Paulo, Brazil","9,028"
378,UFC Fight Night: Mousasi vs. Hall 2,,The SSE Arena,"Belfast, Northern Ireland, U.K.","7,222"
377,UFC 205: Alvarez vs. McGregor,"Nov 12, 2016",Madison Square Garden,"New York City, New York, U.S.","20,427"
376,The Ultimate Fighter Latin America 3 Finale: dos Anjos vs. Ferguson,"Nov 5, 2016",Arena Ciudad de México,"Mexico City, Mexico","11,460"
—,UFC Fight Night: Lamas vs. Penn,"Oct 15, 2016",Mall of Asia Arena,"Pasay, Philippines",Cancelled
375,UFC 204: Bisping vs. Henderson 2,"Oct 8, 2016",Manchester Arena,"Manchester, England, U.K.","16,000"
374,UFC Fight Night: Lineker vs. Dodson,"Oct 1, 2016",Moda Center,"Portland, Oregon, U.S.","6,240"
373,UFC Fight Night: Cyborg vs. Länsberg,"Sep 24, 2016",Ginásio Nilson Nelson,"Brasília, Brazil","8,410"
372,UFC Fight Night: Poirier vs. Johnson,"Sep 17, 2016",State Farm Arena,"Hidalgo, Texas, U.S.","5,624"
371,UFC 203: Miocic vs. Overeem,"Sep 10, 2016",Quicken Loans Arena,"Cleveland, Ohio, U.S.","18,875"
370,UFC Fight Night: Arlovski vs. Barnett,"Sep 3, 2016",Barclaycard Arena,"Hamburg, Germany","11,763"
369,UFC on Fox: Maia vs. Condit,"Aug 27, 2016",Rogers Arena,"Vancouver, British Columbia, Canada","10,533"
368,UFC 202: Diaz vs. McGregor 2,"Aug 20, 2016",T-Mobile Arena,"Las Vegas, Nevada, U.S","15,539"
367,UFC Fight Night: Rodríguez vs. Caceres,"Aug 6, 2016",Vivint Smart Home Arena,"Salt Lake City, Utah, U.S.","6,689"
366,UFC 201: Lawler vs. Woodley,"Jul 30, 2016",Philips Arena,"Atlanta, Georgia, U.S.","10,240"
365,UFC on Fox: Holm vs. Shevchenko,"Jul 23, 2016",United Center,"Chicago, Illinois, U.S.","10,287"
364,UFC Fight Night: McDonald vs. Lineker,"Jul 13, 2016",Denny Sanford Premier Center,"Sioux Falls, South Dakota, U.S.","5,671"
363,UFC 200: Tate vs. Nunes,"Jul 9, 2016",T-Mobile Arena,"Las Vegas, Nevada, U.S","18,202"
362,The Ultimate Fighter: Team Joanna vs. Team Cláudia Finale,"Jul 8, 2016",MGM Grand Garden Arena,,"8,115"
361,UFC Fight Night: dos Anjos vs. Alvarez,"Jul 7, 2016",,,"7,760"
360,UFC Fight Night: MacDonald vs. Thompson,"Jun 18, 2016",TD Place Arena,"Ottawa, Ontario, Canada","10,490"
359,UFC 199: Rockhold vs. Bisping 2,"Jun 4, 2016",The Forum,"Inglewood, California, U.S.","15,587"
358,UFC Fight Night: Almeida vs. Garbrandt,"May 29, 2016",Mandalay Bay Events Center,"Las Vegas, Nevada, U.S.","5,193"
357,UFC 198: Werdum vs. Miocic,"May 14, 2016",Arena da Baixada,"Curitiba, Brazil","45,207"
356,UFC Fight Night: Overeem vs. Arlovski,"May 8, 2016",Rotterdam Ahoy,"Rotterdam, Netherlands","10,421"
355,UFC 197: Jones vs. Saint Preux,"Apr 23, 2016",MGM Grand Garden Arena,"Las Vegas, Nevada, U.S.","11,352"
354,UFC on Fox: Teixeira vs. Evans,"Apr 16, 2016",Amalie Arena,"Tampa, Florida, U.S.","11,273"
353,UFC Fight Night: Rothwell vs. dos Santos,"Apr 10, 2016",Arena Zagreb,"Zagreb, Croatia","13,177"
352,UFC Fight Night: Hunt vs. Mir,"Mar 20, 2016",Brisbane Entertainment Centre,"Brisbane, Australia","9,552"
351,UFC 196: McGregor vs. Diaz,"Mar 5, 2016",MGM Grand Garden Arena,"Las Vegas, Nevada, U.S.","14,898"
350,UFC Fight Night: Silva vs. Bisping,"Feb 27, 2016",The O2 Arena,"London, England, U.K.","16,734"
349,UFC Fight Night: Cowboy vs. Cowboy,"Feb 21, 2016",Consol Energy Center,"Pittsburgh, Pennsylvania, U.S.","7,330"
348,UFC Fight Night: Hendricks vs. Thompson,"Feb 6, 2016",MGM Grand Garden Arena,"Las Vegas, Nevada, U.S.","7,422"
347,UFC on Fox: Johnson vs. Bader,"Jan 30, 2016",Prudential Center,"Newark, New Jersey, U.S.","10,555"
346,UFC Fight Night: Dillashaw vs. Cruz,"Jan 17, 2016",TD Garden,"Boston, Massachusetts, U.S.","12,022"
345,UFC 195: Lawler vs. Condit,"Jan 2, 2016",MGM Grand Garden Arena,"Las Vegas, Nevada, U.S.","10,300"
344,UFC on Fox: dos Anjos vs. Cowboy 2,"Dec 19, 2015",Amway Center,"Orlando, Florida, U.S.","14,459"
343,UFC 194: Aldo vs. McGregor,"Dec 12, 2015",MGM Grand Garden Arena,"Las Vegas, Nevada, U.S.","16,516"
342,The Ultimate Fighter: Team McGregor vs. Team Faber Finale,"Dec 11, 2015",The Chelsea at The Cosmopolitan,,"2,566"
341,UFC Fight Night: Namajunas vs. VanZant,"Dec 10, 2015",,,"1,643"
340,UFC Fight Night: Henderson vs. Masvidal,"Nov 28, 2015",Olympic Gymnastics Arena,"Seoul, South Korea","12,156"
339,The Ultimate Fighter Latin America 2 Finale: Magny vs. Gastelum,"Nov 21, 2015",Arena Monterrey,"Monterrey, Mexico","10,410"
338,UFC 193: Rousey vs. Holm,"Nov 15, 2015",Etihad Stadium,"Melbourne, Australia","56,214"
337,UFC Fight Night: Belfort vs. Henderson 3,"Nov 7, 2015",Ginásio do Ibirapuera,"São Paulo, Brazil","10,628"
336,UFC Fight Night: Holohan vs. Smolka,"Oct 24, 2015",3Arena,"Dublin, Ireland","9,500"
335,UFC 192: Cormier vs. Gustafsson,"Oct 3, 2015",Toyota Center,"Houston, Texas, U.S.","14,622"
334,UFC Fight Night: Barnett vs. Nelson,"Sep 27, 2015",Saitama Super Arena,"Saitama, Japan","10,137"
333,UFC 191: Johnson vs. Dodson 2,"Sep 5, 2015",MGM Grand Garden Arena,"Las Vegas, Nevada, U.S.","10,873"
332,UFC Fight Night: Holloway vs. Oliveira,"Aug 23, 2015",SaskTel Centre,"Saskatoon, Saskatchewan, Canada","7,202"
331,UFC Fight Night: Teixeira vs. Saint Preux,"Aug 8, 2015",Bridgestone Arena,"Nashville, Tennessee, U.S.","7,539"
330,UFC 190: Rousey vs. Correia,"Aug 1, 2015",HSBC Arena,"Rio de Janeiro, Brazil","14,723"
329,UFC on Fox: Dillashaw vs. Barão 2,"Jul 25, 2015",United Center,"Chicago, Illinois, U.S.","11,663"
328,UFC Fight Night: Bisping vs. Leites,"Jul 18, 2015",The SSE Hydro,"Glasgow, Scotland, U.K.","10,451"
327,UFC Fight Night: Mir vs. Duffee,"Jul 15, 2015",Valley View Casino Center,"San Diego, California, U.S.","5,471"
326,The Ultimate Fighter: American Top Team vs. Blackzilians Finale,"Jul 12, 2015",MGM Grand Garden Arena,"Las Vegas, Nevada, U.S.","4,844"
325,UFC 189: Mendes vs. McGregor,"Jul 11, 2015",,,"16,019"
324,UFC Fight Night: Machida vs. Romero,"Jun 27, 2015",Seminole Hard Rock Hotel and Casino,"Hollywood, Florida, U.S.","5,604"
323,UFC Fight Night: Jędrzejczyk vs. Penne,"Jun 20, 2015",O2 World,"Berlin, Germany","8,155"
322,UFC 188: Velasquez vs. Werdum,"Jun 13, 2015",Arena Ciudad de México,"Mexico City, Mexico","21,036"
